{
  "schema_version": "1.0",
  "reviewed_at": "2026-08-26",
  "policy": {"unlisted_complete_source_fidelity": "fidelity-unassured", "effective_completion_rule": "extraction-complete-and-fidelity-assured"},
  "entries": [
    {
      "vigil_source_id": "EXT-7DB18E82C9D3",
      "external_source_id": "EU-AI-ACT-2024-1689",
      "source_version": "2026-07-27",
      "fidelity_status": "requires-reextraction",
      "effective_extraction_status": "partial",
      "assessment_basis": "Direct comparison against the authoritative 27 July 2026 consolidated EUR-Lex text demonstrated material article-level compression. Articles 4a, 9, 10 and 13 have now been re-extracted into 63 deterministic semantic-atomicity migration candidates replacing four coarse article-level abstractions; the remainder of the represented Act scope still requires the same review.",
      "known_fidelity_gaps": [
        "The canonical requirements.json still contains the four coarse Article 4a, 9, 10 and 13 identities until the staged migration is applied and the full corpus validators pass.",
        "Other operator-facing article-level records require the same semantic-atomicity review before clause-level fidelity can be asserted.",
        "The 2026 amendment materially changes applicability and selected obligations; remaining records must be checked against the consolidated 27 July 2026 text rather than assumed unchanged from the original 2024 Act."
      ],
      "audited_requirement_ids": ["EXTREQ-F30E6B9A906370B9", "EXTREQ-44B7BB17CB030468", "EXTREQ-09AD2F5442A55B55", "EXTREQ-126CB22D1FF08066"],
      "next_action": "Apply the staged Article 4a/9/10/13 migration, then continue re-extraction through Articles 11, 12, 14 and 15 and the remaining operator-facing provisions before specialist legal assurance and any fidelity-assured claim."
    },
    {
      "vigil_source_id": "EXT-6442C7954667", "external_source_id": "NIST-AI-100-1", "source_version": "1.0",
      "fidelity_status": "assured", "effective_extraction_status": "complete",
      "assessment_basis": "Direct comparison confirmed that the existing one-record-per-Core-subcategory approach follows NIST's source-defined outcome structure and does not require artificial sentence-level splitting for the audited sample.",
      "known_fidelity_gaps": [], "audited_requirement_ids": ["EXTREQ-6320A5C27CD2562D", "EXTREQ-0055BCF6AB20FDB7"],
      "next_action": "Retain current granularity; re-run fidelity review on material source revision."
    },
    {
      "vigil_source_id": "EXT-DE4FDB52698E", "external_source_id": "NIST-AI-600-1", "source_version": "2024",
      "fidelity_status": "provisional", "effective_extraction_status": "partial",
      "assessment_basis": "Direct metadata-fidelity review of all 223 represented records confirmed that the source-defined suggested-action identities should generally remain stable, but 60 actions contain truncated or compound constituent semantics that are not yet explicitly represented outside compressed analytical prose.",
      "known_fidelity_gaps": ["Sixty source-defined compound actions are recorded in reextraction-backlog.json for constituent-proposition preservation.", "The existing action identity should generally remain stable while constituent semantics are enriched rather than mechanically split.", "The source's AI Actor Tasks apply at subcategory level and are not action-specific; the metadata review preserves them as source-defined tags rather than attributing every listed task to every action."],
      "audited_requirement_ids": ["EXTREQ-FCDE17D3F0843F55", "EXTREQ-0071C7B7B5E64BFA"],
      "next_action": "Enrich the 60 queued source-defined compound actions with explicit constituent propositions before restoring effective complete status."
    },
    {
      "vigil_source_id": "EXT-13FB945E8A06", "external_source_id": "CYCLONEDX-SPEC", "source_version": "1.7",
      "fidelity_status": "provisional", "effective_extraction_status": "partial",
      "assessment_basis": "Direct comparison with the CycloneDX 1.7 JSON schema confirmed three defensible ML-BOM proposition boundaries but found that the modelCard.bom-ref record combines mandatory uniqueness with a recommended reserved-prefix constraint and represents both as mandatory.",
      "known_fidelity_gaps": ["EXTREQ-FA1B882FFAD54D93 requires deterministic semantic decomposition to preserve the distinct MUST uniqueness and SHOULD reserved-prefix modalities."],
      "audited_requirement_ids": ["EXTREQ-29122B7046B06256", "EXTREQ-6C1C17AD6C66F27A", "EXTREQ-B4146C7FA881D345", "EXTREQ-FA1B882FFAD54D93"],
      "next_action": "Re-extract the modelCard.bom-ref constraints without allocating replacement identities during the metadata-review package; retain the other reviewed ML-BOM boundaries."
    },
    {
      "vigil_source_id": "EXT-3CCBC407EAC8", "external_source_id": "IMDA-AGENTIC-AI-MGF", "source_version": "2026-05",
      "fidelity_status": "requires-reextraction", "effective_extraction_status": "partial",
      "assessment_basis": "Direct field-level comparison of all 32 represented records against IMDA Model AI Governance Framework for Agentic AI version 1.5 found 20 records with section-level locators, over-compressed constituent practices, or analytical summaries that add or substitute source semantics.",
      "known_fidelity_gaps": ["Twenty records are queued in reextraction-backlog.json; eight require semantic decomposition with identity migration and twelve require constituent enrichment or locator refinement while preserving identity.", "The current catalogue uses section 2.2, 2.3 or 2.4 locators for propositions stated in narrower subsections, preventing deterministic source traceability.", "Some summaries add unsupported scope, actors or outputs, including a generic required report where the primary text only calls for responsible human contact points."],
      "audited_requirement_ids": ["EXTREQ-14B4DA1E7646754E", "EXTREQ-99712BA8308E32FF", "EXTREQ-47EE577CC52EF131", "EXTREQ-F477502DEE0603FE"],
      "next_action": "Re-extract the 20 queued records against version 1.5 with subsection-precise locators and preserve distinct modalities, conditions and outputs before restoring effective complete status."
    }
  ]
}
